{
  "id": "open3d",
  "name": "Open3D",
  "version": "0.18.0",
  "description": "Modern library for 3D data processing, visualization, and learning with Python and C++ APIs",
  "long_description": "Open3D is an open source library for 3D data processing, visualization, and machine learning, originally developed at Intel Intelligent Systems Lab (ISL) and now maintained as an independent project. Unlike VTK, which emerged from the scientific simulation community, Open3D was designed for the era of depth sensors, point clouds, and 3D deep learning — targeting researchers and engineers in 3D perception, robotics, SLAM, and computer vision rather than traditional scientific simulation.\n\nOpen3D's core capabilities span three domains. For 3D data processing, it provides comprehensive point cloud operations (normal estimation, downsampling, ICP registration, FPFH feature descriptors, plane segmentation), mesh processing (simplification, subdivision, smoothing, Boolean operations), and RGBD data integration via TSDF (Truncated Signed Distance Function) volume reconstruction from depth camera streams. For visualization, it offers a real-time interactive viewer using a modern rendering pipeline backed by Google Filament, supporting PBR materials, image-based lighting, and high-quality surface rendering that is notably more visually appealing than VTK's default output. For 3D deep learning, the Open3D-ML extension provides point cloud semantic segmentation and object detection models.\n\nPython is Open3D's primary interface — pip install open3d provides a Pythonic, NumPy-compatible API that integrates naturally with scientific Python workflows, Jupyter notebooks, and deep learning frameworks. The C++ API is available for performance-critical applications. Open3D is used extensively in robotics research, autonomous driving perception, indoor scene reconstruction, and 3D object recognition. While it overlaps with VTK in some visualization use cases, its focus on modern 3D perception workflows and its significantly more approachable API make it a distinct tool for a different audience.",
  "technique": [
    "rasterization",
    "volume_rendering"
  ],
  "language": "C++/Python",
  "license": "MIT",
  "platforms": [
    "linux",
    "macos",
    "windows"
  ],
  "gpu_support": true,
  "cpu_support": true,
  "real_time": true,
  "scene_formats": [
    "ply",
    "obj",
    "stl",
    "off",
    "gltf",
    "glb",
    "pcd",
    "pts",
    "xyz"
  ],
  "output_formats": [
    "png",
    "jpg",
    "ply",
    "obj",
    "stl",
    "gltf"
  ],
  "homepage": "https://www.open3d.org",
  "repository": "https://github.com/isl-org/Open3D",
  "documentation": "https://www.open3d.org/docs/release/",
  "paper": "https://arxiv.org/abs/1801.09847",
  "paper_bibtex": "@article{zhou2018open3d,\n  title={{Open3D}: {A} Modern Library for {3D} Data Processing},\n  author={Zhou, Qian-Yi and Park, Jaesik and Koltun, Vladlen},\n  journal={arXiv preprint arXiv:1801.09847},\n  year={2018}\n}",
  "first_release": "2018-01-01",
  "latest_release": "2026-09-16",
  "latest_release_version": "0.20.0",
  "status": "active",
  "github_stars": 14126,
  "github_stars_trend": [
    13849,
    14017,
    14126
  ],
  "commit_activity_52w": [
    4,
    0,
    0,
    0,
    0,
    0,
    0,
    0,
    0,
    4,
    1,
    3,
    1,
    0,
    0,
    2,
    5,
    0,
    3,
    0,
    0,
    1,
    0,
    0,
    0,
    0,
    1,
    4,
    4,
    0,
    2,
    1,
    1,
    0,
    1,
    2,
    3,
    1,
    5,
    6,
    2,
    5,
    1,
    1,
    1,
    3,
    0,
    0,
    0,
    0,
    0,
    0
  ],
  "contributor_count": 248,
  "open_issues": 1358,
  "fork_count": 2646,
  "tags": [
    "3d-data-processing",
    "point-cloud",
    "rgbd",
    "reconstruction",
    "robotics",
    "computer-vision",
    "slam",
    "deep-learning",
    "python",
    "icp"
  ],
  "strengths": [
    "Bridges the gap between 3D data processing and visualization in a single Pythonic library — point cloud registration, mesh processing, TSDF reconstruction, and interactive rendering all in one pip install",
    "Excellent point cloud processing capabilities including ICP registration, normal estimation, FPFH feature descriptors, plane segmentation, and voxel downsampling with NumPy-compatible APIs",
    "TSDF volume integration enables real-time 3D reconstruction from depth sensor streams — a capability uniquely accessible through Open3D's Python API compared to lower-level alternatives",
    "Modern rendering via the Google Filament backend provides PBR-quality visualization with image-based lighting that is visually superior to VTK's default Phong shading",
    "Active development with a growing ecosystem for 3D deep learning through Open3D-ML for point cloud segmentation and object detection tasks"
  ],
  "limitations": [
    "Not a production renderer — visualization is designed for exploration and debugging of 3D data, not for generating final rendered output or photorealistic images",
    "Significantly narrower scope than VTK for scientific simulation data — no support for CFD, FEM, or structured grid formats, and no MPI-parallel distributed rendering",
    "3D deep learning extensions (Open3D-ML) are less mature and less widely adopted than dedicated frameworks like PyTorch3D or NVIDIA Kaolin",
    "Documentation has gaps for advanced C++ usage and some newer features, with most examples focused on the Python API",
    "Community is smaller than VTK and ParaView, resulting in fewer domain-specific examples and less institutional support in traditional scientific computing"
  ],
  "best_for": "3D data processing and visualization in Python, particularly for point cloud analysis, RGBD reconstruction, and 3D perception research in robotics and computer vision",
  "not_ideal_for": "Large-scale scientific simulation visualization (use VTK/ParaView), production rendering, game development, or applications requiring distributed HPC rendering",
  "related": [
    "vtk",
    "paraview",
    "filament"
  ],
  "features": {
    "global_illumination": false,
    "path_tracing": false,
    "bidirectional_pt": null,
    "metropolis_lt": null,
    "photon_mapping": null,
    "volumetric": true,
    "subsurface_scattering": false,
    "motion_blur": false,
    "depth_of_field": false,
    "spectral_rendering": false,
    "polarization": false,
    "caustics": null,
    "instancing": false,
    "out_of_core": false,
    "adaptive_sampling": false,
    "denoiser_builtin": false,
    "gpu_rendering": true,
    "multi_gpu": false,
    "network_rendering": false,
    "hardware_ray_tracing": false,
    "differentiable": false,
    "inverse_rendering": false,
    "neural_acceleration": false,
    "real_time_preview": true,
    "pbr_materials": true,
    "hdri_environment": true,
    "shadow_mapping": true,
    "screen_space_effects": true,
    "lod_system": false,
    "animation_support": false,
    "python_api": true,
    "c_cpp_api": true,
    "rust_api": false,
    "javascript_api": false,
    "scene_editor_gui": false,
    "plugin_system": false,
    "open_shading_language": false,
    "materialx": false
  },
  "integrations": [],
  "install_command": "pip install open3d",
  "community_links": {
    "forum": "https://github.com/isl-org/Open3D/discussions",
    "stackoverflow_tag": "open3d"
  },
  "citations": [
    {
      "title": "Open3D: A Modern Library for 3D Data Processing",
      "url": "https://arxiv.org/abs/1801.09847",
      "year": 2018
    }
  ],
  "tutorials": [
    {
      "title": "Open3D Getting Started",
      "url": "https://www.open3d.org/docs/release/getting_started.html",
      "type": "article"
    },
    {
      "title": "Open3D Python Tutorial",
      "url": "https://www.open3d.org/docs/release/tutorial/index.html",
      "type": "article"
    }
  ],
  "thumbnail": "/renders/samples/open3d.webp",
  "sample_renders": [
    "/renders/samples/open3d_sample_1.webp"
  ]
}
